{
  "schema_version": 1,
  "mission_id": "deobf.malware_anti_analysis.v1",
  "mission_kind": "deobf",
  "description": "Deterministic anti-analysis mission for malware evasions and unpacking workflow decisions.",
  "inputs": [
    {
      "name": "packed_binary_ir",
      "type": "object",
      "description": "Normalized intermediate representation of the packed sample.",
      "required": true
    },
    {
      "name": "dynamic_trace",
      "type": "object",
      "description": "Sandbox trace events used to corroborate anti-analysis detections.",
      "required": true
    }
  ],
  "outputs": [
    {
      "name": "anti_analysis_report",
      "description": "Consolidated anti-analysis detection and bypass recommendation report.",
      "source": {
        "kind": "stage_output",
        "stage_id": "emit_report",
        "output": "anti_analysis_report"
      }
    }
  ],
  "policies": {
    "determinism": {
      "execution_order": "linear",
      "stage_selector": "explicit_ids_only",
      "allow_randomness": false
    },
    "conflict_resolution": {
      "source_priority_order": [
        "human",
        "static_analysis",
        "heuristic",
        "ml_model"
      ],
      "confidence_margin": 0.05,
      "tie_breaker": "source_priority_then_stage_id"
    },
    "approval": {
      "human_review_on_apply": true,
      "auto_apply_threshold": 1.0
    },
    "retry_defaults": {
      "max_attempts": 2,
      "backoff_strategy": "linear",
      "initial_delay_ms": 300,
      "jitter": "none"
    }
  },
  "stages": [
    {
      "id": "detect_evasion_patterns",
      "order": 1,
      "kind": "analyze",
      "description": "Detect anti-debug, anti-vm, and unpacking evasion signals from static IR.",
      "depends_on": [],
      "inputs": [
        {
          "name": "packed_binary_ir",
          "source": {
            "kind": "mission_input",
            "input": "packed_binary_ir"
          }
        }
      ],
      "outputs": [
        {
          "name": "evasion_signals",
          "type": "array",
          "description": "Detected anti-analysis signal rows."
        }
      ]
    },
    {
      "id": "correlate_trace",
      "order": 2,
      "kind": "analyze",
      "description": "Correlate static anti-analysis signals with dynamic trace evidence.",
      "depends_on": [
        "detect_evasion_patterns"
      ],
      "inputs": [
        {
          "name": "evasion_signals",
          "source": {
            "kind": "stage_output",
            "stage_id": "detect_evasion_patterns",
            "output": "evasion_signals"
          }
        },
        {
          "name": "dynamic_trace",
          "source": {
            "kind": "mission_input",
            "input": "dynamic_trace"
          }
        }
      ],
      "outputs": [
        {
          "name": "correlated_findings",
          "type": "array",
          "description": "Evidence-linked anti-analysis findings."
        }
      ]
    },
    {
      "id": "emit_report",
      "order": 3,
      "kind": "report",
      "description": "Render deterministic anti-analysis report with recommended mission path.",
      "depends_on": [
        "correlate_trace"
      ],
      "inputs": [
        {
          "name": "correlated_findings",
          "source": {
            "kind": "stage_output",
            "stage_id": "correlate_trace",
            "output": "correlated_findings"
          }
        }
      ],
      "outputs": [
        {
          "name": "anti_analysis_report",
          "type": "object",
          "description": "Deterministic anti-analysis report payload."
        }
      ]
    }
  ]
}
